{
  "$schema": "http://json-schema.org/draft-07/schema#",
  "title": "Project",
  "type": "object",
  "required": ["title", "description"],
  "properties": {
    "title": { "type": "string" },
    "slug": { "type": "string", "pattern": "^[a-z0-9]+(?:-[a-z0-9]+)*$" },
    "description": { "type": "string" },
    "contact": { "type": "string", "format": "email" },
    "tags": {
      "type": "array",
      "items": { "type": "string" }
    },
    "members": {
      "type": "array",
      "items": { "type": "string" }
    },
    "highlights": {
      "type": "array",
      "items": { "type": "string" }
    },
    "semester": { "type": "string" },
    "website": { "type": "string", "format": "uri" },
    "documentation": { "type": "string", "format": "uri" },
    "source": { "type": "string", "format": "uri" },
    "demo": { "type": "string", "format": "uri" },
    "archived": { "type": "boolean", "default": false }
  },
  "additionalProperties": false
}
